{"$schema":"https://json-schema.org/draft/2020-12/schema","additionalProperties":false,"properties":{"authority":{"additionalProperties":false,"properties":{"network":{"additionalProperties":false,"properties":{"hosts":{"items":{"minLength":1,"type":"string"},"type":"array"},"mode":{"enum":["deny","allowlist"],"type":"string"}},"required":["mode","hosts"],"type":"object"},"readAllowlist":{"items":{"minLength":1,"type":"string"},"type":"array"},"writeAllowlist":{"items":{"minLength":1,"type":"string"},"type":"array"}},"required":["readAllowlist","writeAllowlist","network"],"type":"object"},"budget":{"additionalProperties":false,"properties":{"maxAttempts":{"maximum":9007199254740991,"minimum":1,"type":"integer"},"maxFilesChanged":{"maximum":9007199254740991,"minimum":0,"type":"integer"},"timeoutMs":{"maximum":9007199254740991,"minimum":1,"type":"integer"}},"required":["maxAttempts","timeoutMs","maxFilesChanged"],"type":"object"},"commands":{"additionalProperties":false,"properties":{"red":{"minLength":1,"type":"string"},"verify":{"minLength":1,"type":"string"}},"required":["red","verify"],"type":"object"},"contractKind":{"const":"execution-task","type":"string"},"dependsOn":{"items":{"minLength":1,"type":"string"},"type":"array"},"expectedArtifacts":{"items":{"additionalProperties":false,"properties":{"mediaType":{"minLength":1,"type":"string"},"path":{"minLength":1,"type":"string"}},"required":["path","mediaType"],"type":"object"},"type":"array"},"failurePolicy":{"additionalProperties":false,"properties":{"acceptanceFailure":{"enum":["blocked","failed","failed-no-retry","human-review-required"],"type":"string"},"ambiguity":{"enum":["blocked","failed","failed-no-retry","human-review-required"],"type":"string"},"missingInput":{"enum":["blocked","failed","failed-no-retry","human-review-required"],"type":"string"},"policyViolation":{"enum":["blocked","failed","failed-no-retry","human-review-required"],"type":"string"}},"required":["ambiguity","missingInput","policyViolation","acceptanceFailure"],"type":"object"},"inputs":{"items":{"additionalProperties":false,"properties":{"path":{"minLength":1,"type":"string"},"purpose":{"minLength":1,"type":"string"},"sha256":{"pattern":"^sha256:[a-f0-9]{64}$","type":"string"}},"required":["path","sha256","purpose"],"type":"object"},"type":"array"},"programId":{"minLength":1,"type":"string"},"requiredCapabilities":{"items":{"minLength":1,"type":"string"},"type":"array"},"requirements":{"items":{"additionalProperties":false,"properties":{"assertion":{"minLength":1,"type":"string"},"id":{"minLength":1,"type":"string"},"kind":{"enum":["behavior","security","evidence","human-gate"],"type":"string"}},"required":["id","kind","assertion"],"type":"object"},"type":"array"},"role":{"enum":["architect","researcher","builder","verifier","human"],"type":"string"},"schemaVersion":{"const":2,"type":"number"},"state":{"enum":["draft","ready","running","produced","verifying","passed","failed","blocked","human-review-required","approved","closed"],"type":"string"},"taskId":{"minLength":1,"type":"string"},"waveId":{"minLength":1,"type":"string"}},"required":["schemaVersion","contractKind","taskId","programId","waveId","state","dependsOn","role","requiredCapabilities","inputs","authority","requirements","commands","budget","failurePolicy","expectedArtifacts"],"type":"object"}