{"authority":{"network":{"hosts":[],"mode":"deny"},"readAllowlist":["docs/","src/","test/"],"writeAllowlist":["src/execution/gemini-ide-adapter-v2.js","test/gemini-ide-adapter-v2.test.js"]},"budget":{"maxAttempts":3,"maxFilesChanged":2,"timeoutMs":300000},"commands":{"red":"node --test test/gemini-ide-adapter.test.js test/gemini-ide-adapter-v2.test.js test/filesystem-handoff-adapter.test.js","verify":"node --test test/gemini-ide-adapter.test.js test/gemini-ide-adapter-v2.test.js test/filesystem-handoff-adapter.test.js"},"contractKind":"execution-task","dependsOn":["A-06"],"expectedArtifacts":[{"mediaType":"text/javascript","path":"src/execution/gemini-ide-adapter-v2.js"},{"mediaType":"text/javascript","path":"test/gemini-ide-adapter-v2.test.js"}],"failurePolicy":{"acceptanceFailure":"human-review-required","ambiguity":"blocked","missingInput":"blocked","policyViolation":"failed-no-retry"},"inputs":[{"path":"docs/superpowers/specs/2026-09-22-antigravity-executable-continuity-and-transmutation-design.md","purpose":"approved-specification","sha256":"sha256:79570098f0a736ee636cdd5956fec2e728c97eed8f230957880d3f5c708c0a8c"}],"programId":"A","requiredCapabilities":[],"requirements":[{"assertion":"Run test/gemini-ide-adapter.test.js test/gemini-ide-adapter-v2.test.js test/filesystem-handoff-adapter.test.js","id":"verification","kind":"evidence"}],"role":"builder","schemaVersion":2,"state":"blocked","taskId":"A-08","waveId":"program-a"}