{"authority":{"network":{"hosts":[],"mode":"deny"},"readAllowlist":["docs/","src/","test/"],"writeAllowlist":["schemas/v2/","scripts/generate-continuity-schemas.js","src/continuity/contracts.js","test/continuity-contracts.test.js"]},"budget":{"maxAttempts":3,"maxFilesChanged":4,"timeoutMs":300000},"commands":{"red":"node --test test/continuity-contracts.test.js test/task-contract.test.js test/blueprint.test.js","verify":"node --test test/continuity-contracts.test.js test/task-contract.test.js test/blueprint.test.js"},"contractKind":"execution-task","dependsOn":["A-01"],"expectedArtifacts":[{"mediaType":"text/plain","path":"schemas/v2/"},{"mediaType":"text/javascript","path":"scripts/generate-continuity-schemas.js"},{"mediaType":"text/javascript","path":"src/continuity/contracts.js"},{"mediaType":"text/javascript","path":"test/continuity-contracts.test.js"}],"failurePolicy":{"acceptanceFailure":"human-review-required","ambiguity":"blocked","missingInput":"blocked","policyViolation":"failed-no-retry"},"inputs":[{"path":"docs/superpowers/specs/2026-09-22-antigravity-executable-continuity-and-transmutation-design.md","purpose":"approved-specification","sha256":"sha256:79570098f0a736ee636cdd5956fec2e728c97eed8f230957880d3f5c708c0a8c"}],"programId":"A","requiredCapabilities":[],"requirements":[{"assertion":"Run test/continuity-contracts.test.js test/task-contract.test.js test/blueprint.test.js","id":"verification","kind":"evidence"}],"role":"builder","schemaVersion":2,"state":"verifying","taskId":"A-02","waveId":"program-a"}