{"authority":{"network":{"hosts":[],"mode":"deny"},"readAllowlist":["docs/","src/","test/"],"writeAllowlist":["continuity/","scripts/init-continuity.js","src/continuity/baseline-audit.js","test/continuity-baseline.test.js"]},"budget":{"maxAttempts":3,"maxFilesChanged":4,"timeoutMs":300000},"commands":{"red":"node --test test/continuity-baseline.test.js","verify":"node --test test/continuity-baseline.test.js"},"contractKind":"execution-task","dependsOn":["A-03"],"expectedArtifacts":[{"mediaType":"text/plain","path":"continuity/"},{"mediaType":"text/javascript","path":"scripts/init-continuity.js"},{"mediaType":"text/javascript","path":"src/continuity/baseline-audit.js"},{"mediaType":"text/javascript","path":"test/continuity-baseline.test.js"}],"failurePolicy":{"acceptanceFailure":"human-review-required","ambiguity":"blocked","missingInput":"blocked","policyViolation":"failed-no-retry"},"inputs":[{"path":"docs/superpowers/specs/2026-09-22-antigravity-executable-continuity-and-transmutation-design.md","purpose":"approved-specification","sha256":"sha256:79570098f0a736ee636cdd5956fec2e728c97eed8f230957880d3f5c708c0a8c"}],"programId":"A","requiredCapabilities":[],"requirements":[{"assertion":"Run test/continuity-baseline.test.js","id":"verification","kind":"evidence"}],"role":"builder","schemaVersion":2,"state":"blocked","taskId":"A-04","waveId":"program-a"}