{"authority":{"network":{"hosts":[],"mode":"deny"},"readAllowlist":["docs/","src/","test/"],"writeAllowlist":["scripts/run-clean-checkout-continuity-drill.js","scripts/run-continuity-conformance.js","test/continuity-conformance.integration.test.js"]},"budget":{"maxAttempts":3,"maxFilesChanged":3,"timeoutMs":300000},"commands":{"red":"node --test test/continuity-conformance.integration.test.js","verify":"node --test test/continuity-conformance.integration.test.js"},"contractKind":"execution-task","dependsOn":["A-10"],"expectedArtifacts":[{"mediaType":"text/javascript","path":"scripts/run-clean-checkout-continuity-drill.js"},{"mediaType":"text/javascript","path":"scripts/run-continuity-conformance.js"},{"mediaType":"text/javascript","path":"test/continuity-conformance.integration.test.js"}],"failurePolicy":{"acceptanceFailure":"human-review-required","ambiguity":"blocked","missingInput":"blocked","policyViolation":"failed-no-retry"},"inputs":[{"path":"docs/superpowers/specs/2026-09-22-antigravity-executable-continuity-and-transmutation-design.md","purpose":"approved-specification","sha256":"sha256:79570098f0a736ee636cdd5956fec2e728c97eed8f230957880d3f5c708c0a8c"}],"programId":"A","requiredCapabilities":[],"requirements":[{"assertion":"Run test/continuity-conformance.integration.test.js && node scripts/run-clean-checkout-continuity-drill.js --source . && npm test","id":"verification","kind":"evidence"}],"role":"builder","schemaVersion":2,"state":"blocked","taskId":"A-11","waveId":"program-a"}