{"authority":{"network":{"hosts":[],"mode":"deny"},"readAllowlist":["docs/","src/","test/"],"writeAllowlist":["src/continuity/file-store.js","src/design/canonical-json.js","src/shared/canonical-json.js","test/continuity-primitives.test.js"]},"budget":{"maxAttempts":3,"maxFilesChanged":4,"timeoutMs":300000},"commands":{"red":"node --test test/continuity-primitives.test.js test/reference-authority-and-v2-transmuter.test.js","verify":"node --test test/continuity-primitives.test.js test/reference-authority-and-v2-transmuter.test.js"},"contractKind":"execution-task","dependsOn":[],"expectedArtifacts":[{"mediaType":"text/javascript","path":"src/continuity/file-store.js"},{"mediaType":"text/javascript","path":"src/design/canonical-json.js"},{"mediaType":"text/javascript","path":"src/shared/canonical-json.js"},{"mediaType":"text/javascript","path":"test/continuity-primitives.test.js"}],"failurePolicy":{"acceptanceFailure":"human-review-required","ambiguity":"blocked","missingInput":"blocked","policyViolation":"failed-no-retry"},"inputs":[{"path":"docs/superpowers/specs/2026-09-22-antigravity-executable-continuity-and-transmutation-design.md","purpose":"approved-specification","sha256":"sha256:79570098f0a736ee636cdd5956fec2e728c97eed8f230957880d3f5c708c0a8c"}],"programId":"A","requiredCapabilities":[],"requirements":[{"assertion":"Run test/continuity-primitives.test.js test/reference-authority-and-v2-transmuter.test.js","id":"verification","kind":"evidence"}],"role":"builder","schemaVersion":2,"state":"verifying","taskId":"A-01","waveId":"program-a"}