{"authority":{"network":{"hosts":[],"mode":"deny"},"readAllowlist":["docs/","src/","test/"],"writeAllowlist":["src/continuity/event-ledger.js","src/continuity/evidence-store.js","src/continuity/human-decision-authority.js","src/continuity/roadmap-engine.js","src/continuity/state-store.js","test/continuity-authority.test.js","test/continuity-roadmap-engine.test.js","test/continuity-state-store.test.js"]},"budget":{"maxAttempts":3,"maxFilesChanged":8,"timeoutMs":300000},"commands":{"red":"node --test test/continuity-state-store.test.js test/continuity-authority.test.js test/continuity-roadmap-engine.test.js","verify":"node --test test/continuity-state-store.test.js test/continuity-authority.test.js test/continuity-roadmap-engine.test.js"},"contractKind":"execution-task","dependsOn":["A-02"],"expectedArtifacts":[{"mediaType":"text/javascript","path":"src/continuity/event-ledger.js"},{"mediaType":"text/javascript","path":"src/continuity/evidence-store.js"},{"mediaType":"text/javascript","path":"src/continuity/human-decision-authority.js"},{"mediaType":"text/javascript","path":"src/continuity/roadmap-engine.js"},{"mediaType":"text/javascript","path":"src/continuity/state-store.js"},{"mediaType":"text/javascript","path":"test/continuity-authority.test.js"},{"mediaType":"text/javascript","path":"test/continuity-roadmap-engine.test.js"},{"mediaType":"text/javascript","path":"test/continuity-state-store.test.js"}],"failurePolicy":{"acceptanceFailure":"human-review-required","ambiguity":"blocked","missingInput":"blocked","policyViolation":"failed-no-retry"},"inputs":[{"path":"docs/superpowers/specs/2026-09-22-antigravity-executable-continuity-and-transmutation-design.md","purpose":"approved-specification","sha256":"sha256:79570098f0a736ee636cdd5956fec2e728c97eed8f230957880d3f5c708c0a8c"}],"programId":"A","requiredCapabilities":[],"requirements":[{"assertion":"Run test/continuity-state-store.test.js test/continuity-authority.test.js test/continuity-roadmap-engine.test.js","id":"verification","kind":"evidence"}],"role":"builder","schemaVersion":2,"state":"verifying","taskId":"A-03","waveId":"program-a"}